{
  "schema_version": "1.0",
  "id": "CHECKOUT_1",
  "items": [
    {
      "title": "Zentra Pulse 5G (Midnight Black, 8GB RAM, 128GB Storage)",
      "quantity": 1,
      "price": {
        "amount": 17999,
        "currency": "INR"
      }
    },
    {
      "title": "Silicone Back Cover for Zentra Pulse 5G",
      "quantity": 2,
      "price": {
        "amount": 598,
        "currency": "INR"
      }
    }
  ],
  "subtotal": {
    "amount": 18597,
    "currency": "INR"
  },
  "delivery_charge": {
    "amount": 0,
    "currency": "INR"
  },
  "total": {
    "amount": 18597,
    "currency": "INR"
  },
  "delivery_pin_code": "500032",
  "delivery_address": "ADDR_1",
  "payment_method": "cod",
  "place_order_target_id": "t-place-order",
  "missing": []
}
